{
  "schemaVersion": 1,
  "id": "13d669ce-def2-50aa-aca5-9114ab4dc521",
  "slug": "balsamic-vinaigrette",
  "title": "Balsamic Vinaigrette",
  "description": null,
  "category": "Protein Recipes",
  "subcategory": "KETO RECIPES",
  "tags": [
    "keto"
  ],
  "servings": null,
  "times": [],
  "ingredients": [
    {
      "raw": "3 TBSP oil (extra-virgin olive oil)",
      "quantity": 3,
      "quantityMax": null,
      "unit": "tbsp",
      "item": "oil",
      "prep": null,
      "note": "extra-virgin olive oil",
      "group": null,
      "optional": false,
      "confidence": "high",
      "shop": true,
      "catalogId": "vegetable-oil",
      "amount": {
        "value": 44.36,
        "unit": "ml"
      }
    },
    {
      "raw": "1 TBSP balsamic vinegar",
      "quantity": 1,
      "quantityMax": null,
      "unit": "tbsp",
      "item": "balsamic vinegar",
      "prep": null,
      "note": null,
      "group": null,
      "optional": false,
      "confidence": "high",
      "shop": true,
      "catalogId": "balsamic-vinegar",
      "amount": {
        "value": 14.787,
        "unit": "ml"
      }
    },
    {
      "raw": "1/2 teaspoon minced garlic",
      "quantity": 0.5,
      "quantityMax": null,
      "unit": "tsp",
      "item": "minced garlic",
      "prep": null,
      "note": null,
      "group": null,
      "optional": false,
      "confidence": "high",
      "shop": true,
      "catalogId": "garlic",
      "amount": {
        "value": 2.464,
        "unit": "ml"
      }
    },
    {
      "raw": "1 pinch Italian seasoning (optional)",
      "quantity": 1,
      "quantityMax": null,
      "unit": "pinch",
      "item": "Italian seasoning",
      "prep": null,
      "note": null,
      "group": null,
      "optional": true,
      "confidence": "high",
      "shop": true,
      "catalogId": "italian-seasoning",
      "amount": {
        "value": 0.31,
        "unit": "ml",
        "approximate": true
      }
    }
  ],
  "steps": [
    {
      "text": "Shake all ingredients together in a tightly-lidded container OR whisk together in a small bowl.",
      "group": null
    },
    {
      "text": "Let stand 10 minutes to rehydrate dried herbs and blend flavors.",
      "group": null
    },
    {
      "text": "Shake again then dress salad as desired.",
      "group": null
    }
  ],
  "footnotes": [],
  "nutrition": null,
  "importedNotes": [
    {
      "text": "Use on strong greens such as escarole, curly endive, and dandelion greens."
    }
  ],
  "seeAlso": [],
  "source": {
    "attribution": null,
    "file": "RECIPES/PROTEIN RECIPES/KETO RECIPES/Basic Vinaigrette.doc",
    "type": "doc",
    "duplicateFiles": []
  }
}
